Original_Article,cleaned_Article
sept 19 reuters drugmaker beigene 6160hk said tuesday would regain right develop manufacture cancer drug termination deal swiss drugmaker novartis novns agreement deal signed 2021 company jointly developing drug tevimbra drug currently review us food drug administration treatment type esophageal cancer prior chemotherapy,"Swiss drugmaker beigene 6160hk said t Tuesday would regain right to develop manufacture cancer drug termination deal. Beigene said it would not be able to develop or manufacture cancer drugs for the next five years after termination deal with Swiss drugmaker. Beige said it will not be allowed to develop, manufacture or test cancer drugs."
brukinsa first btk inhibitor approved follicular lymphoma european union approval based result rosewood trial brukinsa plus anticd20 monoclonal antibody obinutuzumab achieved higher overall response rate compared obinutuzumab alone beigene ltd bgne hkex 06160 sse 688235 global biotechnology company today announced european commission ec granted marketing authorization brukinsa® zanubrutinib combination obinutuzumab treatment adult patient relapsed refractory rr follicular lymphoma fl received least two prior line systemic therapy mark fourth indication european union eu brukinsa approved treat patient population eu brutons tyrosine kinase btk inhibitor approval excited announce brukinsa become available treatment option patient follicular lymphoma european union brukinsa first btk inhibitor approved indication broadest label medicine class globally said mehrdad mobasher md mph chief medical officer hematology beigene milestone mark significant advancement effort combat disease providing new effective treatment option patient either failed respond initial therapy experienced relapse ec approval based positive result rosewood nct03332017 global randomized openlabel phase 2 study brukinsa plus obinutuzumab compared obinutuzumab alone 217 patient rr fl received least two prior line systemic therapy study overall response rate 690 brukinsa plus obinutuzumab arm versus 458 obinutuzumab arm p 00012 median followup approximately 20 month responses durable 18month landmark duration response dor 693 brukinsa combination arm additionally median progressionfree survival pfs patient treated brukinsa plus obinutuzumab 280 month compared 104 month patient treated obinutuzumab hr 050 95 ci 033 075 p 00007 brukinsa plus obinutuzumab generally welltolerated safety result consistent previous study medicine people living follicular lymphoma often experience relapse poor response subsequent line therapy making imperative improve outcome said pier luigi zinzani md phd full professor haematology institute haematology seràgnoli university bologna italy result rosewood trial demonstrated significant clinical benefit brukinsa plus obinutuzumab patient relapsed refractory follicular lymphoma brukinsa chemotherapyfree oral treatment option practicechanging option eligible patient relapsed refractory follicular lymphoma addition rr fl brukinsa approved eu monotherapy treatment adult patient chronic lymphocytic leukemia adult patient marginal zone lymphoma received least one prior anticd20based therapy adult patient waldenströms macroglobulinemia received least one prior therapy firstline treatment patient unsuitable chemoimmunotherapy gerwin winter senior vice president head europe beigene noted made great progress making brukinsa available eligible patient hematological malignancy globally approval testament continued commitment bring much needed treatment option patient europe around world hope approval positive impact life many people living follicular lymphoma european union family beigene currently submission brukinsa rr fl review regulatory authority including united states us china additionally beigenes submission brukinsa rr fl review regulatory authority canada switzerland united kingdom part access consortium new active substance worksharing initiative naswsi brukinsa approved 65 market including us china eu great britain canada australia south korea switzerland selected indication development additional indication globally product information may differ country country prescribers consult product information approved respective country global brukinsa development program includes 5000 subject enrolled date 29 country region summary product characteristics brukinsa found httpswwwemaeuropaeuendocumentsproductinformationbrukinsaeparproductinformationenpdf fl second common type nonhodgkin lymphoma nhl accounting 22 percent nhl casesi across europe 122000 people year diagnosed nhlii fl slowgrowing cancer become aggressive time fl remains incurable people condition live long time fiveyear survival rate 90 percent approximately half people diagnosed fl live disease nearly 20 yearsiiiiv brukinsa small molecule inhibitor brutons tyrosine kinase btk discovered beigene scientist currently evaluated globally broad clinical program monotherapy combination therapy treat various bcell malignancy new btk continuously synthesized brukinsa specifically designed deliver complete sustained inhibition btk protein optimizing bioavailability halflife selectivity differentiated pharmacokinetics compared approved btk inhibitor brukinsa demonstrated inhibit proliferation malignant b cell within number disease relevant tissue beigene global biotechnology company discovering developing innovative oncology treatment affordable accessible cancer patient worldwide broad portfolio expediting development diverse pipeline novel therapeutic internal capability collaboration committed radically improving access medicine far patient need growing global team 10000 colleague span five continent administrative office basel beijing cambridge us learn beigene please visit wwwbeigenecom follow u linkedin x formerly known twitter press release contains forwardlooking statement within meaning private securities litigation reform act 1995 federal security law including statement regarding beigenes ability provide effective treatment option patient fl whether brukinsa practicechanging option eligible patient effect ec approval brukinsa rr fl people living rr fl family beigenes advancement anticipated clinical development regulatory submission commercialization zanubrutinib particularly treatment rr fl beigenes plan commitment aspiration goal heading beigene actual result may differ materially indicated forwardlooking statement result various important factor including beigenes ability demonstrate efficacy safety drug candidate clinical result drug candidate may support development marketing approval action regulatory agency may affect initiation timing progress clinical trial marketing approval beigenes ability achieve commercial success marketed medicine drug candidate approved beigenes ability obtain maintain protection intellectual property medicine technology beigenes reliance third party conduct drug development manufacturing commercialization service beigenes limited experience obtaining regulatory approval commercializing pharmaceutical product ability obtain additional funding operation complete development drug candidate achieve maintain profitability risk fully discussed section entitled risk factors beigenes recent quarterly report form 10q well discussion potential risk uncertainty important factor beigenes subsequent filing us securities exchange commission information press release date press release beigene undertakes duty update information unless required law,brukinsa first btk inhibitor approved follicular lymphoma european union approval based on result rosewood trial. brukinsa plus antic Brukinsa is a combination of the two drugs. It is the first time a btk inhibitors has been approved for follicular  lymphoma.
whether youre looking quick bite eat sitdown experience quick caffeinated pickmeup plenty food option choose labor day favorite chain open year however location may reduced hour good idea check local location confirm store hour heading holiday annual celebration social economic achievement american worker say us department labor holiday trace root back late nineteenth century labor activist pushed federal holiday recognize many contribution worker made americans strength prosperity wellbeing according department restaurant fast food chain open sept 4 2023 hours vary location mcdonalds location open labor day check hour local restaurant chickfila restaurant open labor day although may limited operating hour check hour local restaurant chickfila app find restaurant tab website starbucks store hour vary location find hour specific store using starbucks app yes dunkin store hour vary location customers check hour local store using dunkin app online store locator hours vary location check local taco bells hour ihop hour vary location check local restaurant hour hours vary location check hour local applebees restaurant whats open labor daysee full list restaurant grocery store retail restaurant major chain operating normal business hour unless noted otherwise • texas roadhouse customers encouraged contact local restaurant check specific hour operation,"whether youre looking quick bite eat sitdown experience quick caffeinated pickmeup plenty food option choose labor day favorite chain open year however location. Whether you're looking quick bites eat sit down experience quick coffee pickmeups plenty food options choose labor Day favorite chain. Whether it's a quick bite or a sitdown, there's plenty of food option for you."
federal judge new york dismissed lawsuit accused mcdonald’s wendy’s misleading consumer ad show bigger juicier burger restaurant actually serve opinion released weekend us district judge hector gonzalez said image companies’ website plaintiff challenging note weight meat calorie burger contains gonzalez also said plaintiff justin chimienti failed prove reasonable customer would misled ad gonzalez said ad considered “puffery” akin companies’ use model make product visually appealing suit one several false advertising lawsuit filed recently fast food company new york attorney james kelly message seeking comment kelly left tuesday associated press august federal judge florida refused dismiss class action lawsuit kelly filed burger king claiming company’s ad overstate amount meat whopper burger sandwich kelly also sued taco bell arby’s lawsuits accusing food beverage company misleading customer putting fewer chip expected bag advertising artificial flavor real “vanilla” example grown common recent year perkins coie law firm track class action suit said 214 filed food beverage company 2022 101 filed first six month year that’s big increase 2010 45 filed,federal judge new york dismissed lawsuit accused mcdonalds wendy’s misleading consumer ad show bigger juicier. Judge dismissed lawsuit accusing mcdonald’S of misleading consumers with ‘bigger juicer’ and ‘happier’
future fast food delivery diners within 12mile radius brandonvalrico chickfila central florida option spicy chicken sandwich milkshake delivered via drone limited time drone delivery available 10 6 pm monday friday restaurant announced social medium last week fast food joint said hope expand 2mile radius near future restaurant partnered droneup virginiabased tech company also launched drone delivery service tampa walmart last year tampa bay times reported popular fried chicken chain declined share drone delivery would introduced next “we early stage testing drone delivery small number chickfila restaurants” chickfila spokesperson chelsea lee told local newspaper email customers must select “drone delivery” option chickfila app special service employee load food order cardboard box attach box drone outside restaurant according video posted restaurant showing process work drone fly food destination lower box cable drop gently ground customer pick drinks sealed leaving restaurant also delivered location said “just got – super fast food hot perfect – thanks” one satisfied customer commented restaurant’s facebook page another posted video delivery dropped home “the exciting thing ever” quipped drones latest delivery innovation chickfila trying company announced last may testing autonomous delivery vehicle select restaurant across country,future fast food delivery diners within 12mile radius. brandonvalrico chickfila central florida option spicy chicken sandwich milksh. option spicy Chicken Sandwich milkshake. option  chicken sandwich and milkshakes. option chickfila.com.
yum brands topped wall street estimate thirdquarter result wednesday reboot popular menu item taco bell promotional deal kfc pulled budgetstrapped customer looking cheaper restaurant meal company banked aggressive promotion limitedtime offer drive demand return fanfavorite volcano menu 5 box taco bell helping chain outpace broader slowdown restaurant industry taco bell’s deal aided 2 3 increase customer transaction brand quarter yum brands ceo david gibbs said postearnings call “there pressure us consumer … certainly industry softened little bit … u though us much favorable situation taco bell majority sale profit country” gibbs added taco bell also plan improve loyalty program bid boost order frequency spending starting next year chain would make easier member earn redeem point offer perk early access new product meanwhile pizza hut losing market share rival including papa john’s papa murphy’s lesser extent little caesars loss noticeably worsening september data research firm science showed “we’ve seen lot competition pizza space … driving incremental weakness pizza hut” said sante faustini iii director product intelligence science pizza hut’s global samestore sale growth 1 lagged estimate 208 quarter according lseg data global samestore sale taco bell kfc jumped betterthanexpected 8 6 respectively company’s overall samestore sale rose 6 beating estimate 473 increase,"yum brands topped wall street estimate thirdquarter result wednesday reboot popular menu item taco bell promotional deal kfc pulled budgetstrapped customer looking. kfc pulls budgetstrapping customer looking by offering a $1,000 gift card to customers who buy a $100 gift card from kfc."
fancy taco bells nacho fries fastfood chain two new deal cooking make month nacho fries new nacho fries lovers pass 10 pas available taco bell rewards members get regular order nacho fries every day 30 consecutive day become rewards member sign taco bell app dec 4 taco bell new twist popular nacho fries dish grilled cheese nacho fries limitedtime menu item 499 available starting thursday nov 16 feature seasoned fry topped mozzarella monterey pepper jack cheddar cheese grilled steak also ordered jalapeños new limitedtime menu item taco bell also available thursday nov 16 • chicken quesadilla combo 889 price may vary slightly quesadilla crunchy taco fountain drink • 5 cravings box meal made chalupa supreme beefy 5layer burrito crunchy taco cinnamon twists medium drink • rolled chicken tacos snack marinated allwhitemeat chicken fried corn tortilla ordered 2pack 299 1 dip 4pack 549 2 dip rolled chicken tacos deluxe cravings box 2pack rolled chicken tacos 1 dip seasoned beef chalupa supreme beefy 5layer burrito cinnamon twists medium drink food recallmore cantaloupe product added recall possible salmonella contamination tuesday nov 21 taco bell rewards members get free delivery build meal 4 2499 – choose get 4 taco bells 3 classic menu item burrito burrito two side including nacho fry add four medium drink 4 participating location supply last available order ahead pickup via online app delivery taco bell app available instore taco bell lover chicago get taste test new dish breakfast tots tot come seasoned scrambled egg choice bacon sausage topped melted mozzarella pepper jack cheddar cheese 349449 depending choice protein • nov 16nov 22 members doordashs dasspass get 5 order 20 order grilled cheese nacho fries • nov 21 free beef soft taco order 20 uber eats active uber one customer • nov 24nov 26 3 20 order doordash uber eats postmates grubhub dinner hour 5pm9pm whats everyone talking sign trending newsletter get latest news day,fancy taco bells nacho fries fastfood chain two new deal cooking make month nacho fries. 10 pas available available. Nacho fries lovers pass 10 pas on their way to get their fix of the fast-food treat. The 10 pas are available for a limited time only.
taco bell serving new toasted breakfast tacos giving away free next three taco tuesdays toasted breakfast tacos new menu option made egg melted cheese choice bacon sausage potato grilled tortilla priced 149 fast food chain also offering limited time vegan sauce nacho fries crispy seasoned fry certified vegan returned menu sept 28 available large size 299 addition regular size 219 ordered vegan sauce – made soybean oil chickpea protein ingredient – price get free toasted breakfast taco taco bell taco bell rewards members get free toasted breakfast taco within taco bell app next three tuesdays oct 17 oct 24 oct 31 purchase necessary also bought taco lover’s pass earlier month make toasted breakfast taco taco choice pas cost 10 unlocks option app choose type taco – example also include crunchy taco supreme doritos locos tacos – get restaurant 30 consecutive day • friday oct 13 get 3 order 13 taco bell app 1 per user • saturday oct 14 get free cinnamon twist delight order 1 1 per user national desert day • oct 16oct 20 free nacho fries order 15 11 2 pm local time doordash ubereats postmates grubhub nutrition detail taco bells toasted breakfast bacon taco according restaurant chain nutrition detail taco bells nacho fries vegan sauce according restaurant chain whats everyone talking sign trending newsletter get latest news day,taco bell serving new toasted breakfast tacos giving away free next three taco tuesdays toasted Breakfast Tacos. New menu option made egg melted on new breakfast tacos. Toasted Breakfast tacos are served with a toasted egg or with a plain egg McMuffin.
oct 30 reuters mcdonalds mcdn beat wall street estimate thirdquarter profit sale monday powered new launch well steady demand cheaper burger fry diner struggling stillhigh food price shares company rose 2 261 premarket trading also raised quarterly cash dividend 10 burger giant able keep meal relatively affordable following industrywide hike price last year helping counter trend inflationhit consumer opting eat home decline footfall global comparable sale mcdonalds jumped 88 quarter ended sept 30 analyst average expected 736 rise according lseg data drawing history menu enhancement mcdonalds launched cheesy jalapeno bacon quarter pounder july brought back fanfavorite spicy chicken mcnuggets menu september item likely drove solid sale growth third quarter ubs analyst noted overall dining traffic fell three month quarter mcdonalds saw 73 jump july data placerai showed footfall strength company tapered next two month recording decline 11 37 remained ahead broader industry trend comparable sale united states climbed 81 quarter beating estimate 74 increase thanks also higher average spending store meanwhile samestore sale mcdonalds international operated market increased 83 edging past expectation 803 growth total quarterly revenue increased 14 669 billion beating estimate 658 billion net income rose 232 billion 317 per share 198 billion 268 per share year earlier adjusted basis mcdonalds posted pershare profit 319 handily beating estimate 300,oct 30 reuters mcdonalds mcdn beat wall street estimate thirdquarter profit sale monday powered new launch well. steady demand steady demand cheaper burger fry. McDonalds beat wall Street estimate third quarter profit sale sale m Monday powered new release well steady demand. McDonald's beat wallStreet estimate third quarterly profit sale Monday.
whether dip drizzle put chicken nugget french fry mcdonald’s sauce assortment expanding fall fast food chain announced tuesday adding two new limitededition sauce us menu two week new sauce — mcdonald’s sweet spicy jam mcdonald’s mambosauce — hit menu oct 9 according news release company whopper really smallburger king must face whopper lawsuit alleging burger small say judge mcdonalds two new sauce heres new limitededition duo • sweet spicy jam chain describes breakfastinspired jammy red pepper dipping sauce tonguenumbing szechuan peppercorn kick also includes apple cider vinegar cayenne pepper • mambosauce one described mcds tomatobased sweet spicy vinegary sauce inspired washington dc area sauce staple company came new sauce exploring incredible taste flavor found community across country tariq hassan chief marking customer experience officer chain said news release sauce live intersection flavor culturepulling decade rich food history tradition local restaurant home kitchen bringing delicious spice sweetness kick heat know today’s customer craving hassan said mcds said teaming six foodie content creator review sauce share pairing suggestion idea customer respective tiktok channel creator mreats305 sharidyonne santanakeish misslegarda natelovlogs blackgirlsexploredc we’re passing mic biggest sauce fan — food content creator — get authentic reaction first drizzle dip bite hassan said creator mreats305 sharidyonne santanakeish misslegarda natelovlogs blackgirlsexploredc natalie neysa alund senior correspondent usa today reach nalundusatodaycom follow x platform formerly known twitter nataliealund,McDonald’s is expanding its dipping options. The fast food chain announced tuesday adding two dipping sauces to its menu. The sauces will be available in two different dipping sauces: dipping sauce and dipping sauce drizzle. The company is also adding a dipping sauce option to its fries.
parent company taco bell kfc pizza hut using artificial intelligence upsell taco wing pizza yum brands executive told analyst wednesday they’re using ai increase sale select restaurant goal using emerging technology location coming year artificial intelligence system suggests menu item tested handful restaurant california yum brands chief financial officer chris turner told investor company reported thirdquarter earnings say many restaurant testing new technology yum brands representative immediately respond message seeking comment yum reported solid three month company sold 171 billion fast food third quarter 4 increase compared period last year overall store sale grew 6 one company’s major restaurant chain however saw tepid growth pizza hut’s store sale grew 1 quarter ended sept 30 compared period last year turner said ai cuttingedge technology intended make worker efficient necessarily replace system “is early stage piloting free team member time allow focus customer experience” said turner explain exactly ai system work said taco bell yum brands restaurant use data customer loyalty program customize order company’s first flirtation artificial intelligence yum brands already employ ai predict inventory item needed individual store help general manager keep inventory stocked,parent company taco bell kfc pizza hut using artificial intelligence upsell taco wing pizza yum brands executive told analyst wednesday they’re using the technology to upsell tacos and pizzas. The company has not revealed how much money it has made from the technology so far.
announced collaboration nike may 2023 strava launched integration nike run club nrc nike training club ntc apps new integration enables athlete nike’s leading fitness apps track workout connect community across strava nike platform nike member using nrc ntc apps begin syncing workout strava simply authorizing integration apps setting addition nrc ntc activity uploads strava nike member access • nike’s expert content nikebranded club featuring tip guidance motivation nike’s coach athlete including coach bennett chelsea cox jes woods • challenges strava around shared goal enabling athlete also track progress unlock nike reward • strava global community 750000 club live within strava platform “people keep people active – strava platform athlete go 21 farther workout last 10 longer group” said mateo ortega vice president connected partnerships strava “our mission help connect community motivation get moving – whether local run club connect inperson inspiration top athlete coach we’ve seen nike club strava” nike latest app provider join strava’s platform engages 100 million athlete worldwide athletes new york city celebrate launch integration joining nike strava community run saturday september 23 starting nike well collective battery park,"announced collaboration nike may 2023 strava launched integration nike run club nrc nike training club ntc apps new integration enables athlete to train and compete with each other. nike and strava will launch a partnership in the summer of 2023. strava is a joint venture between strava and Nike, with a focus on training and competition."
