Original_Article,cleaned_Article
retailers maker food marketed weight loss type company could see knockon effect rise diabetes weight loss drug like ozempic every summer publicly traded company posted secondquarter result americans baring body beach year timing apt several earnings call august chief executive reassured investor ozempic revolution left dust could somehow share blazing success new diabetes weight loss drug “it put u good position solution drugs” said dan r chard chief executive medifast make diet product like shake protein bar adding “they’re looking guidance” told analyst even explaining newgeneration drug helped pummel earnings 347 percent year year “we continue study this” michael johnson chief executive nutritional supplement maker herbalife told investor “and see opportunity capitalize will” theory opportunity — making profit losing fortune — could vast company behind drug also completely different industry known glp1 drug medication already driving big profit novo nordisk make ozempic approved type 2 diabetes close relative wegovy approved weight loss mimic glucagonlike peptide regulates appetite brain leaving people feeling sated hour together helped send novo’s earnings rocketing 32 percent first half year novo’s market value larger entire danish economy eli lilly’s sale surged 28 percent second quarter thanks another diabetes drug mounjaro food drug administration may approve weight loss year full potential isn’t even clear yet market weight loss drug huge roughly 750 million obese people worldwide including 42 percent adult united states obesityrelated illness incur billion dollar health care cost year novo say glp1 drug could eventually us like helping prevent cardiovascular disease among obese adult sign could treat addiction even alzheimer’s “the market potential significant” novo’s chief financial officer karsten knudsen told visited company june “we’re operating kind unusual territory” ripple effect widening retailers like walmart kroger rite aid say glp1 prescription bringing people store make purchase walmart’s chief executive doug mcmillon told analyst august executive “expect consumables health wellness primarily due popularity glp1 drug grow percent total” medtronic’s chief executive geoff martha said company seen “modest” dip bariatric surgery presumably people opted weight loss drug instead analyst believe drug could disrupt american diet “if you’re eating fast food every day you’ll probably continue eat fast food every day” james van geelen citrinas capital management said bloomberg’s “odd lots” podcast “you eat lot le it” still room approach fighting obesity “these drug game changer asterisk” said david ludwig obesity specialist pediatrics professor harvard medical school drug come long list side effect “even reduce weight across population drug it’s going eliminate risk poor diet” flush cash novo agrees “we need looking what’s next thing” executive vice president commercial strategy camilla sylvest told june company launched obesity prevention unit near copenhagen research stop disease people need take drug lose weight — vivienne walt us labor market begin look like old self employers added 187000 job august labor department reported friday unemployment rose 38 percent economy continued lose momentum built pandemic lockdown commerce secretary gina raimondo visit china tricky task promoting trade two superpower holding firm technology export limit imposed name american national security two country agreed create new dialogue including working group commercial issue white house name first drug set medicare price negotiation longawaited list 10 medicine subject landmark new program meant reduce cost medicare drugmakers pushed back plan including court republicans criticized initiative government overreach ubs report 29 billion quarterly profit asterisk huge gain — biggest banking history — stem bank’s acquisition rival credit suisse spring 32 billion steep discount skewing ubs’s result belies challenge ubs face move complete largest takeover bank since 2008 financial crisis emily weiss stepped last year chief executive glossier skin care beauty brand founded 2014 called end “girlboss” archetype — mediasavvy female founder venturedarling millennialfocused startup — propelled “girlboss” nasty girl founder sophia amoruso’s 2014 memoir glossier directtoconsumer model voicey website changed way woman buy makeup eventually passing 1 billion valuation brand stumbled struggled move brickandmortar retail faced criticism retail employee alleged toxic racist working environment shelved project like makeup line departed dewy barelythere look dealbook spoke marisa meltzer author upcoming book “glossy ambition beauty inside story emily weiss’s glossier” lesson might glean weiss girlboss movement interview edited condensed clarity contextualize girlboss movement pretty offensive diminutive one except sophia calling girlboss also something benefited attracted interest way get press business wasn’t typical thing female founder ceos sometimes like fashion spread big debate time whether press would covered scandal company like outdoor voices man repeller glossier differently men helm think think bit thirst blood woman propped way kind annoying — i’m sure annoying company real problem like sued firing pregnant employee company like glossier accusation workplace largely retail employee wasn’t ideal that’s different criminal behavior reality company weren’t woman helm weren’t making mistake also didn’t level success happens glossier glossier seems taken time since emily stepped reevaluate decided really belatedly go retail launched sephora last february larger task they’re trying make company better shape exit,retailers maker food marketed weight loss type company could see knockon effect rise diabetes weight loss drug like ozempic every summer publicly traded. The company is expected to be valued between $1 billion and $2 billion by the end of the year. The stock is currently trading at around $9 a share.
move ozempic — there’s new drug town eli lilly’s zepbound active ingredient tirzepatide approved food drug administration use obese overweight adult least one weightrelated health complication like type 2 diabetes high blood pressure high cholesterol tirzepatide sold mounjaro already approved treating type 2 diabetes since may 2022 patient prescribed drug chronic weight management “obesity overweight serious condition associated leading cause death heart disease stroke diabetes” dr john sharretts director division diabetes lipid disorders obesity fda’s center drug evaluation research said statement “in light increasing rate obesity overweight united states today’s approval address unmet medical need” approximately 70 americans overweight obese according fda worrying report published world obesity federation year projected half world’s population could overweight obese 2035 however fda report dropping 5 10 overall body weight lower risk developing heart disease result — cue weight management drug help people lose stubborn pound diet exercise alone fail “unfortunately despite scientific evidence contrary obesity often seen lifestyle choice – something people manage themselves” dr leonard glass senior vice president global medical affair lilly diabetes obesity said statement “lilly aiming eliminate misperceptions disease transform managed” zepbound approved wednesday shown effective chronic weight management drug combination lifestyle change like diet exercise activating receptor two hormone — glucagonlike peptide1 glp1 glucosedependent insulinotropic polypeptide gip — suppress appetite thereby curbing food intake side effect weekly injectable include nausea vomiting abdominal discomfort pain fatigue diarrhea constipation burping hair loss acid reflux allergic reaction trial drug caused thyroid ccell tumor rodent although unknown whether zepbound result cancer human according drug’s manufacturer zepbound expected available americans end year list price approximately 1059 eli lilly estimate 20 le rival semaglutide otherwise known novo nordisk’s ozempic wegovy cost staggering 1300 demand weight loss cureall soar led market dangerous counterfeit dupe landed desperate user hospital despite pressure medication access “it improve change insurance coverage” limited explained dr angela fitch chief medical officer weightinclusive healthcare company knownwell “it remains problem obesity treated carve condition instead standard benefit despite fact chronic condition” told post statement “we’re hopeful continued advocacy advancement science data continue see improved access lifechanging medication”,"move ozempic — there’s new drug town eli lilly’‘s zepbound active ingredient tirzepat. The drug town is called Ozempic. The town is located in the town of Eli, in the state of Mississippi."
sept 14 reuters bristol myers squibb bmyn said thursday plan double number treatment testing clinical trial focus cell therapy next 18 month contends increasing generic competition two topselling drug drugmaker currently six candidate trial advance six research pipeline including three cell therapy target immune system disorder different type cancer new yorkbased company pressured declining demand two top drug blood cancer treatment revlimid blood thinner eliquis face generic competition bristol partner pfizers pfen blood thinner eliquis also list 10 drug subject firstever price negotiation us medicare health program company recently received regulatory approval new cell therapy manufacturing facility devens massachusetts bristol said continue expanding manufacturing capacity bristol already two approved cell therapy us breyanzi abecma targeting different blood cancer indication said plan continue development treatment disease lupus erythematosus multiple sclerosis drugmaker hosting rd day thursday executive expected provide detail company research strategy,Bristol Myers Squibb to double number of treatment testing clinical trial focus cell therapy. The drug is being developed by Bristol-Myers Squibbs and Myers-Squibb. The company is also developing a cancer drug called    Bristol-Meyer Bixby.
austin wolcott 18 year old pretty sure wouldn’t survive year summer 2020 wolcott given disheartening news stage 4 classical hodgkin’s lymphoma he’d battling year back despite aggressive chemotherapy briefly sent cancer remission malignancy spread vertebra doctor bone marrow transplant clinic chapel hill north carolina idea would wolcott willing try relatively new experimental treatment something called cart therapy “i didn’t feel especially hopeful willing try anything may help” say wolcott everything cart “sounded like something sciencefiction movie” say “it portrayed cancerseeking missile knew exactly go do” description isn’t hyperbolic say dr michael chu oncologist who’s leading cart clinical trial cross cancer institute edmonton alberta cart therapy basically boil building cell outsmart cancer beating game “cancers aren’t supposed develop humans” chu explains “our tcells capable recognizing killing mutated cell happens” cancer especially sneaky “they hide identifying barcodes tcells can’t see them” cart therapy patient’s tcells—white blood cell fight viruses—are removed body genetically edited “a new barcode reader hence name chimeric antigen receptor car” chu say new improved cancerkilling canceridentifying machine returned body ready start allout cellular war imagine tcells miniterminators without arnold schwarzenegger’s accent although doubtful wolcott took chance trial received first cart infusion nov 6 2020 “the side effect minor body aches” say within day cancer retreating month later gone “as today two year eight month 26 day remission” say cart therapy may household name yet it’s cusp revolutionizing cancer treatment since first approved fda advanced leukemia 2017—thenfda commissioner scott gottlieb called “a new frontier medical innovation”—the science jumped leap bound six cart therapy available various blood cancer used target everything lymphoma leukemia myeloma still clinical trial stage 2022 report university philadelphia found two three patient treated cart therapy chronic lymphocytic leukemia decade later still remission “so many patient miraculously cured cart” say dr john f dipersio chief division oncology washington university st louis he’s even watched medical colleague cancer surgeon come close death lymphoma complete recovery thanks cart science around cart come long way since ‘90s immunologist like dr michel sadelain first trying convince peer genetically engineered tcells technology worth exploring “in beginning ‘why would one bother engineer cells’ later ‘this work’” say sadelain recently awarded breakthrough prize along university pennsylvania immunologist carl june work cart therapy “after demonstrated feasibility efficacy mouse 2003 ‘this work humans’” idea “ran contrary common approach stimulate tcells based vaccines” say sadelain enough persistence remarkable early trial result skepticism turned excitement therapy worked miracle patient many others nothing reason still aren’t clear “tumors evolve way suppress immune system” say dr brian brown director icahn genomics institute mount sinai new york city “for example cancer flip switch tcells turn put brake tcells” tcells outsmart cancer cell game still investigated there’s also problem cytokine pesky molecule released cart cell promote inflammation lead dangerously high fever vomiting organ failure recent research dr michael mitchell associate professor school engineering applied science university pennsylvania developed new method “essentially stop cytokine release cart therapy” say cells treated sugar injected polymer called polyethylene glycol creates mitchell call “suit armor” around tcells preventing cytokine release mitchell feel hopeful new technology won’t make difference current cart therapy might even demonstrate “potential address grand challenge face using cart cell treat solid tumors” solid tumor comprise majority cancers—like breast colon lung cancer — far eluded cart therapy “blood cancer easier attack car tcells” say chu “they’re essentially blood car tcells first introduced car tcells ‘find’ solid tumor crossing blood organ soft tissues” manipulating tcells super car tcells — “armored” cell mitchell developing—might key finally making cart feasible option attacking solid cancer there’s issue cost outofpocket infusion price range 375000 475000 per person many insurance provider pay least bill — medicare instance reimburses around 65 treatment cost — that’s procedure side effect like high fever severe nausea trouble breathing keep cart patient intensive care week walked away 1 million debt “the cost must come down” say dipersio obvious way reducing regulatory mandate fda — dipersio think unlikely happen — developing “offtheshelf” therapy use engineered cell third party rather patient’s tcells big pharma company like astrazeneca novartis already conducting trial offtheshelf technology another development could affect staggering cost transforming treatment lengthy costly hospital visit outpatient procedure say brown “the goal scenario patient come injected dna rna turn fraction patient’s cell cart cell go kill cancer cell would big impact cost” despite hurdle many involved cart cell research cautiously optimistic technology heading “this tip iceberg” say chu “there car tcells shown significant activity glioblastoma multiforme — common brain cancer including one killed senator john mccain—and form muscle bone cancers” brown say cart therapy potential used beyond cancer like inflammation autoimmune disease “and possibly even treat aging” say “it’s science fiction thing already demonstrated animal model eventually move humans” though seismic shift won’t happen overnight—“outside pandemic medicine move slowly” brown say — it’s still remarkable they’ve achieved far made brown believe therapy something special — “we’re living minute big bang” put —are statistic “it’s common u read result clinical trial new drug squint see difference” say “you read drug extended life sick patient sixmonth survival eightmonth survival” cart say number startling “they’re reporting remission year don’t radiologist see difference tumor mass hadn’t shrunk completely gone patients” wolcott who’s 22 living wife—whom met soon got sick — greensboro nc he’s still shock cancer thought would kill remains moment rearview mirror “the day found officially remission felt like first day life” say salute 1000 day cancerfree wolcott celebrated trip september blue ridge rock festival standing dancing hour blazing southern sun would’ve unthinkable wolcott year ago “there time treatment felt like i’d spend rest life locked inside” wolcott say “every day i’m alive world feel grateful”,"austin wolcott 18 year old pretty sure wouldn’t survive year summer 2020. wolott given disheartening news stage at a press conference in Washington, D.C. on Monday. The 18-year-old was taken to a local hospital in a critical condition. He was later pronounced dead."
cancer often referred “emperor maladies” unyielding adversary present formidable challenge global health complex amalgamation disease unique characteristic making treatment continuous arduous battle healthcare professional patient everevolving landscape cancer therapeutic one name carving unique space innovative solution cytomed therapeutics equipped novel disruptive approach blend advanced cellular science cuttingedge biotechnology cytomed championing revolution aiming transform battlefield cancer treatment mission finding effective solution also making solution accessible affordable thereby addressing one significant barrier cancer care prohibitive cost journey cytomed encapsulates determined stride towards breaking barrier changing narrative bringing hope million affected cancer globally cancer umbrella term multitude disease characterized uncontrolled growth spread cell stand testament biological complexity conglomerate disease unique genetic mutation cellular interaction response external factor put forth staggering level intricacy making considerable challenge formulate execute effective treatment complexity confined biological dimension also extends socioeconomic aspect cancer care diverse range cancer subtypes distinct biological characteristic necessitates development plethora therapy tailored target specific cancer type stage approach potentially effective inevitably inflates cost research development production therapy thereby driving overall cost cancer treatment adding equation cancer’s relentless nature often demand longterm intensive treatment escalating financial burden patient healthcare system financial toxicity associated cancer treatment significant often pose insurmountable barrier access making potentially lifesaving treatment unattainable many patient context dr wee kiat tan chief operating officer cytomed therapeutics underline profound truth saying could best solution disease treatment affordable going sentiment highlight inherent challenge cancer treatment also brings fore core philosophy cytomed therapeutics – develop effective also affordable solution cancer ongoing war cancer chimeric antigen receptor tcell cart therapy emerged revolutionary ally leveraging body immune system fight cancer cart therapy unlocked new avenue hope countless patient groundbreaking treatment modality involves genetically modifying patient cell recognize destroy cancer cell effectively turning immune system potent precise weapon disease cart therapy represents personalized approach cancer treatment particularly effective blood cancer like leukemia lymphoma result various clinical trial compelling patient achieving complete remission term rarely associated advancedstage cancer however despite transformative potential cart therapy set challenge firstly cost associated therapy exceptionally high largely cart therapy custommade patient involving complex process extraction genetic modification reinfusion cell high degree customization requires specialized lab sophisticated technology skilled personnel contribute overall cost patientspecific nature cart therapy mean cannot massproduced stored future use raise scalability issue particularly attempting treat large number patient addition time taken cell extraction reinfusion span several week duration patient condition potentially deteriorate light hurdle associated traditional cart therapy cytomed therapeutics offering potentially gamechanging alternative biotechnology company pioneered “one product many patients” approach strategy eliminates need patientspecific customization thereby addressing critical limitation traditional cart therapy core cytomeds strategy gamma delta cell subgroup cell derived healthy donor gamma delta cell long underappreciated part immune system recent research begun shed light potential unlike cell gamma delta cell recognize wide array cancer without need complex genetic modification conventionally prerequisite cart therapy universal applicability cell allows cytomed create “offtheshelf product significant departure traditional cart model eliminating need patientspecific customization cytomeds approach reduce cost logistical complexity associated therapy essence company working democratize access advanced cancer therapy making accessible broader patient population allowing largescale production therapy cytomeds model stand significantly reduce cost associated cart treatment could potentially transform cart therapy highcost lowvolume treatment affordable highvolume option shift could revolutionize cancer treatment “one product many patients” paradigm successfully implemented could mark significant stride evolution cart therapy making potent form immunotherapy universally applicable cytomeds approach could help bring promise cart therapy larger patient population critical step forward making cancer treatment equitable affordable effective cytomeds relentless drive innovation continues break new ground cart therapy ongoing research potential advancement enhancing efficiency gamma delta cell extraction refining precision targeting capability actively pursued vision future highquality cancer therapy privilege standard accessible grows ever closer cytomeds ongoing effort dr tan passionately sum aspiration good solution make affordable,cancer often referred “emperor maladies’ unyielding adversary present formidable challenge global health complex amalgamation disease unique characteristic making treatment difficult. Cancer often referred to as ‘emperors mal ailments’ and ‘the emperor of disease’. ‘The Emperor of Disease’ is a term used to refer to a variety of cancers.
nov 28 reuters us food drug administration fda said tuesday investigating cancer therapy made company gilead sciences gildo johnson johnson jnjn risk hospitalization death due serious safety issue fda said received report tcell malignancy refer group blood disorder including lymphoma leukemia treatment cart therapy chimeric antigen receptor tcell therapy approved cancer therapy class include bristol myers squibbs bmyn breyanzi partnered therapy abecma 2seventy bio tsvto jj unit janssen legend biotechs legno carvykti novartis ags novns kymriah gileads unit kites tecartus yescarta also part investigation shares gilead marginally legends stock fell 42 afternoon trading autolus therapeutics autlo also developing cart therapy nearly 12 rbc analyst said note believed concern could higher novartis kymriah extremely rare marketed carts gilead said cooperated fda request analysis company data adding evidence treatment either two therapy causal role development new malignancy confident overall safety profile tecartus yescarta gilead told reuters emailed statement cart therapy chimeric antigen receptor tcell therapy generally involve extracting diseasefighting tcells patient reengineering attack cancer infusing back body jj bristol myers novartis immediately respond reuters request comment patients clinical trial participant receiving treatment product monitored lifelong new malignancy fda said,"Food drug administration fda said t Tuesday investigating cancer therapy made by gilead sciences. Fda said it is investigating whether the therapy is safe and effective for humans. Gilead Sciences is a subsidiary of the drug giant Pfizer, which is under fire for its treatment of cancer."
nov 21 reuters beigene 6160hk said tuesday entered agreement biotech company ensem therapeutics acquire global license cancer therapy ready enter earlystage trial term deal ensem receive upfront payment eligible additional payment totaling 133 billion achievement certain milestone addition tiered royalty,nov 21 reuters beigene 6160hk said t Tuesday entered agreement biotech company ensem therapeutics acquire global license cancer therapy ready. Ensem is a biotech company that specializes in developing cancer treatments. The deal is expected to close in the second half of this year.
